{
  "activityName": "Spring pea seed, organic, at farm gate {FR} U",
  "categories": ["ingredient", "material"],
  "displayName": "Pois de printemps Bio",
  "id": "c12b6c6d-2e98-5c2a-8cbb-683da1e068a3",
  "location": "FR",
  "metadata": [
    {
      "alias": "spring-pea-organic",
      "cropGroup": "PROTEAGINEUX",
      "cropGroupMatch": { "confidence": 0.95, "rule": "matched 'pois de printemps' in cropgroup.csv" },
      "defaultOrigin": "France",
      "displayName": "Pois de printemps Bio",
      "id": "8514450f-35a9-5a51-a3d5-b28e2e21d5a5",
      "inediblePart": 0.2,
      "inediblePartMatch": {
        "confidence": 1.0,
        "rule": "legume NOVA 1 default from food_type_inedible_part.csv"
      },
      "ingredientCategories": ["vegetable_fresh", "organic"],
      "ingredientDensity": 0.8,
      "ingredientDensityMatch": { "confidence": 0.95, "rule": "Matched with pea in density.csv" },
      "rawToCookedRatio": 1.0,
      "rawToCookedRatioMatch": { "confidence": 0.95, "rule": "Matched with pea in cooked_to_raw.csv" },
      "scenario": "organic",
      "scopes": ["food", "food2"],
      "transportCooling": "always",
      "transportCoolingMatch": { "confidence": 1.0, "rule": "legume NOVA 1 → always (perishable)" },
      "visible": true
    }
  ],
  "scopes": ["food", "food2"],
  "source": "Agribalyse 3.2",
  "unit": "kg"
}
