{
  "activityName": "Soup, mixed vegetables, dehydrated, at plant {FR} U",
  "categories": ["ingredient", "material"],
  "displayName": "Soupe déshydratée FR",
  "id": "a30166e4-1eb6-5419-8a1a-8663da9d1f70",
  "metadata": [
    {
      "alias": "soup-dehydrated-fr",
      "cropGroup": "LEGUMES-FLEURS",
      "defaultOrigin": "France",
      "displayName": "Soupe déshydratée FR",
      "id": "e01522ad-886c-4599-81b9-9e0f1d82e0e7",
      "inediblePart": 0,
      "ingredientCategories": ["vegetable_processed"],
      "ingredientDensity": 0.6195,
      "rawToCookedRatio": 12,
      "scenario": "reference",
      "scopes": ["food", "food2"],
      "transportCooling": "none",
      "visible": true
    }
  ],
  "scopes": ["food", "food2"],
  "source": "Agribalyse 3.2"
}
