{
  "categories": [
    "transformation"
  ],
  "comment": "Ancien identifiant (12/2024): 9c478d79-ff6b-45e1-9396-c3bd897faa1d.",
  "displayName": "Tricotage moyen (mix de métiers circulaire & rectiligne)",
  "elecKwh": 2.4,
  "heatMJ": 0,
  "id": "29dc6c73-8d82-5056-8ac0-faf212bc0367",
  "impacts": {
    "acd": 0,
    "cch": 0,
    "etf": 0,
    "etf-c": 0,
    "fru": 0,
    "fwe": 0,
    "htc": 0,
    "htc-c": 0,
    "htn": 0,
    "htn-c": 0,
    "ior": 0,
    "ldu": 0,
    "mru": 0,
    "ozd": 0,
    "pco": 0,
    "pma": 0,
    "swe": 0,
    "tre": 0,
    "wtu": 0
  },
  "qtyVariationRatio": 0.94554,
  "scopes": [
    "textile"
  ],
  "source": "Ecobalyse_manual_lcia",
  "unit": "kg"
}
