{
  "categories": ["transformation", "material_type:cereals"],
  "comment": "Elec et chaleur de 'Wheat flour, at plant {FR} U' (Agribalyse 3.2), ramenées au kg de soft wheat. 1.16 kg par kg de produit. Source : classeur ecolysis Food-Transformer V3.2b, ligne 1449. Généré par ecobalyse-method-tooling/food/koch-components.",
  "displayName": "Transformation : Farine UE",
  "elecKwh": 0.06926,
  "heatMJ": 0.01236,
  "id": "a32dc403-d9a6-513c-a730-de19c1ee9a44",
  "impacts": {
    "acd": 0,
    "cch": 0,
    "etf": 0,
    "etf-c": 0,
    "fru": 0,
    "fwe": 0,
    "htc": 0,
    "htc-c": 0,
    "htn": 0,
    "htn-c": 0,
    "ior": 0,
    "ldu": 0,
    "mru": 0,
    "ozd": 0,
    "pco": 0,
    "pma": 0,
    "swe": 0,
    "tre": 0,
    "wtu": 0
  },
  "metadata": [
    { "id": "ce5e9e79-a515-5b28-9ddd-f6a62b8a6716", "scopes": ["food2"] }
  ],
  "qtyVariationRatio": 0.8629,
  "scopes": ["food2"],
  "source": "Ecobalyse_manual_lcia",
  "unit": "kg"
}
