{
  "activityName": "Tea, dried {KE}| tea production, dried | Cut-off, U - Adapted from Ecoinvent U",
  "categories": ["ingredient", "material"],
  "displayName": "Tea, dried (KE)",
  "id": "f6ab53ef-3a7b-5780-a3f2-3e8aefffc6cf",
  "metadata": [
    {
      "alias": "tea-dried-2025",
      "cropGroup": "VERGERS",
      "defaultOrigin": "EuropeAndMaghreb",
      "displayName": "Thé (feuilles) UE (2025)",
      "id": "97f56acd-962e-4a4b-af42-1e468d2017a0",
      "inediblePart": 0,
      "ingredientCategories": ["misc"],
      "ingredientDensity": 0.5,
      "rawToCookedRatio": 1.0,
      "scenario": "import",
      "scopes": ["food", "food2"],
      "transportCooling": "none",
      "visible": false
    },
    {
      "alias": "unknown-groceries-2025",
      "cropGroup": "VERGERS",
      "defaultOrigin": "EuropeAndMaghreb",
      "displayName": "Autres ingrédients divers (non encore répertoriés) (2025)",
      "id": "3211b18f-83b2-4cf8-a0fd-42962f70b8b4",
      "inediblePart": 0,
      "ingredientCategories": ["misc"],
      "ingredientDensity": 1.0,
      "rawToCookedRatio": 1.0,
      "scenario": "import",
      "scopes": ["food", "food2"],
      "transportCooling": "none",
      "visible": true
    },
    {
      "alias": "tea-dried-non-eu",
      "cropGroup": "DIVERS",
      "cropGroupMatch": { "confidence": 0.95, "rule": "matched 'tea' in cropgroup.csv" },
      "defaultOrigin": "OutOfEuropeAndMaghreb",
      "displayName": "Thé, feuilles séchées HORS UE",
      "id": "b767e665-ad96-5200-ad67-11ac66e81559",
      "inediblePart": 0.0,
      "inediblePartMatch": {
        "confidence": 1.0,
        "rule": "beverage NOVA 1 default from food_type_inedible_part.csv"
      },
      "ingredientCategories": ["misc"],
      "ingredientDensity": 0.9,
      "ingredientDensityMatch": { "confidence": 1.0, "rule": "beverage default from predict.py" },
      "rawToCookedRatio": 1.0,
      "rawToCookedRatioMatch": { "confidence": 1.0, "rule": "beverage default from food_type_cooked_to_raw.csv" },
      "scenario": "import",
      "scopes": ["food", "food2"],
      "transportCooling": "none",
      "transportCoolingMatch": { "confidence": 1.0, "rule": "dried packaging → none" },
      "visible": true
    }
  ],
  "scopes": ["food", "food2"],
  "source": "Agribalyse 3.2",
  "unit": "kg"
}
