{
  "activityName": "Mandarin {ES}| mandarin production | Cut-off, U - Adapted from Ecoinvent U",
  "categories": ["ingredient", "material"],
  "displayName": "Mandarine UE",
  "id": "47a6326d-969a-5507-9f37-946a10aca6fa",
  "metadata": [
    {
      "alias": "mandarin-eu-2025",
      "cropGroup": "VERGERS",
      "defaultOrigin": "EuropeAndMaghreb",
      "displayName": "Mandarine UE (2025)",
      "explain": "icv ue = icv ES",
      "id": "7967ae83-ba85-4a8f-aed9-e96717fc4284",
      "inediblePart": 0.2,
      "ingredientCategories": ["vegetable_fresh"],
      "ingredientDensity": 0.575,
      "scenario": "import",
      "scopes": ["food", "food2"],
      "transportCooling": "always",
      "visible": true
    }
  ],
  "scopes": ["food", "food2"],
  "source": "Agribalyse 3.2"
}
