{
  "activityName": "Peach, production mix, national average, at orchard {FR} U",
  "categories": ["ingredient", "material"],
  "displayName": "Pêche FR",
  "id": "e9553ddf-857a-58be-b1e7-55f7f556c96f",
  "metadata": [
    {
      "alias": "peach-fr-2025",
      "cropGroup": "VERGERS",
      "defaultOrigin": "France",
      "displayName": "Pêche FR (2025)",
      "id": "a0012089-de27-45ae-89d1-863f71a06e72",
      "inediblePart": 0.2,
      "ingredientCategories": ["vegetable_fresh"],
      "ingredientDensity": 0.447,
      "scenario": "reference",
      "scopes": ["food", "food2"],
      "transportCooling": "none",
      "visible": false
    }
  ],
  "scopes": ["food", "food2"],
  "source": "Agribalyse 3.2"
}
