{
  "categories": ["transformation", "material_type:other_food_items"],
  "comment": "Elec et chaleur de 'Black pepper, dried, consumption mix {FR} U' (Agribalyse 3.2), ramenées au kg de black pepper. 2.86 kg par kg de produit. Source : classeur ecolysis Food-Transformer V3.2b, ligne 94. Généré par ecobalyse-method-tooling/food/koch-components.",
  "displayName": "Transformation : Poivre noir par défaut",
  "elecKwh": 0.2037,
  "heatMJ": 0.0,
  "id": "08942f02-cf7c-5883-984e-8b6f03ab2441",
  "impacts": {
    "acd": 0,
    "cch": 0,
    "etf": 0,
    "etf-c": 0,
    "fru": 0,
    "fwe": 0,
    "htc": 0,
    "htc-c": 0,
    "htn": 0,
    "htn-c": 0,
    "ior": 0,
    "ldu": 0,
    "mru": 0,
    "ozd": 0,
    "pco": 0,
    "pma": 0,
    "swe": 0,
    "tre": 0,
    "wtu": 0
  },
  "metadata": [
    { "id": "70860769-9749-58ab-b1df-4fbcaaede777", "scopes": ["food2"] }
  ],
  "qtyVariationRatio": 0.35,
  "scopes": ["food2"],
  "source": "Ecobalyse_manual_lcia",
  "unit": "kg"
}
